{
  "$schema": "./locale.schema.json",
  "schemaVersion": 1,
  "locale": "en",
  "name": "English",
  "direction": "ltr",
  "messages": {
    "app.name": "Sideral Editor",
    "app.browserPreview": "Browser preview — native file actions are unavailable.",
    "activity.explorer": "Explorer",
    "activity.settings": "Settings",
    "topbar.workspace": "Workspace",
    "topbar.untitledWorkspace": "No folder open",
    "action.newFile": "New file",
    "action.openFile": "Open file",
    "action.openFolder": "Open folder",
    "action.save": "Save",
    "action.saveAs": "Save as",
    "action.close": "Close",
    "action.discard": "Discard changes",
    "action.cancel": "Cancel",
    "action.retry": "Try again",
    "action.refresh": "Refresh",
    "action.openTranslationsFolder": "Open translations folder",
    "action.checkUpdates": "Check for updates",
    "action.trustSchemaUri": "Trust this URL",
    "action.trustSchemaOrigin": "Trust this origin",
    "action.removeSchemaTrust": "Remove",
    "explorer.title": "Explorer",
    "explorer.noFolderTitle": "Start with a folder",
    "explorer.noFolderDescription": "Open a project folder to browse and edit its files.",
    "explorer.empty": "This folder is empty.",
    "explorer.loading": "Loading files…",
    "explorer.symlink": "Symbolic link",
    "welcome.eyebrow": "A focused place to build",
    "welcome.title": "Code without the noise.",
    "welcome.description": "A fast, native workspace with the essentials visible and everything else out of your way.",
    "welcome.newFileHint": "Create a clean text buffer",
    "welcome.openFileHint": "Edit an existing file",
    "welcome.openFolderHint": "Browse a complete project",
    "editor.untitled": "Untitled",
    "editor.dirty": "Unsaved changes",
    "editor.readOnly": "Read only",
    "editor.closeDirty": "Save or discard the changes before closing this tab.",
    "editor.schemaTrustTitle": "Trust JSON schema?",
    "editor.schemaTrustDescription": "This document references a JSON schema from a location that Sideral Editor does not trust yet.",
    "editor.schemaTrustSafety": "Schemas are downloaded over HTTPS and used only as validation data. Trust the exact URL unless you know and trust the entire origin.",
    "editor.schemaLocation": "Schema URL",
    "editor.schemaOrigin": "Origin",
    "editor.schemaLoadFailed": "The JSON schema could not be loaded: {reason}",
    "editor.schemaTrustDeclined": "The JSON schema was not loaded because {uri} is not trusted.",
    "status.ready": "Ready",
    "status.saved": "Saved",
    "status.saving": "Saving…",
    "status.lineColumn": "Ln {line}, Col {column}",
    "status.encoding": "UTF-8",
    "settings.title": "Settings",
    "settings.subtitle": "Keep the editor comfortable and predictable.",
    "settings.applicationSection": "Application",
    "settings.applicationDescription": "Choose how Sideral Editor saves, starts, and behaves when its main window closes.",
    "settings.startWithWindows": "Start with Windows",
    "settings.startWithWindowsDescription": "Open Sideral Editor automatically when you sign in to Windows.",
    "settings.startMinimized": "Start minimized",
    "settings.startMinimizedDescription": "When started with Windows, keep Sideral Editor in the system tray.",
    "settings.closeToTray": "Move to tray when closing",
    "settings.closeToTrayDescription": "Keep Sideral Editor running in the background when the main window is closed.",
    "settings.autoSave": "Auto Save",
    "settings.autoSaveDescription": "Save existing files after 1 second without changes. New untitled files still use Ctrl+S.",
    "settings.savingDesktopPreferences": "Saving application settings…",
    "settings.languageSection": "Display language",
    "settings.languageDescription": "Use the system language automatically or choose one manually.",
    "settings.systemLanguage": "System language",
    "settings.activeLanguage": "Active: {language}",
    "settings.translationSection": "Community translations",
    "settings.translationDescription": "Copy a JSON locale file into this folder. It is validated and appears here when the window regains focus.",
    "settings.translationPath": "Translation folder",
    "settings.invalidLocales": "Some translation files were ignored",
    "settings.invalidLocaleFile": "{file}: {reason}",
    "settings.noLocaleIssues": "All translation files are valid.",
    "settings.localeFallback": "The saved language was unavailable, so {language} was selected.",
    "settings.jsonSchemasSection": "JSON schemas",
    "settings.jsonSchemasDescription": "Review the remote locations allowed to provide validation, completion, and hover information for JSON files.",
    "settings.builtInSchemaOrigins": "Built-in trusted origins",
    "settings.additionalSchemaTrust": "Additional trusted locations",
    "settings.loadingSchemaTrust": "Loading trusted locations…",
    "settings.noAdditionalSchemaTrust": "No additional locations are trusted.",
    "settings.schemaOrigin": "Origin",
    "settings.schemaUri": "Exact URL",
    "settings.updatesSection": "Updates",
    "settings.updatesDescription": "Sideral Editor checks once when it starts. You can also check manually.",
    "settings.updaterNotConfigured": "Updates will be enabled after a signed release endpoint is configured.",
    "updates.badgeLabel": "Update available",
    "updates.title": "Sideral Editor update",
    "updates.available": "Version {version} is ready to download.",
    "updates.currentVersion": "Current version",
    "updates.newVersion": "New version",
    "updates.releaseNotes": "What’s new",
    "updates.noReleaseNotes": "No release notes were provided.",
    "updates.download": "Download and install",
    "updates.downloading": "Downloading update…",
    "updates.installing": "Installing update…",
    "updates.installingDetail": "Download complete. The signed package is now being installed.",
    "updates.ready": "The update is installed and ready.",
    "updates.restart": "Restart Sideral Editor",
    "updates.checked": "Sideral Editor is up to date.",
    "updates.checking": "Checking for updates…",
    "updates.failed": "The update could not be completed.",
    "updates.progress": "{percent}% · {downloaded} of {total}",
    "updates.progressUnknown": "{downloaded} downloaded",
    "updates.eta": "About {time} remaining",
    "updates.closeDuringTransfer": "Keep Sideral Editor open while the update is transferred and installed.",
    "error.title": "Something went wrong",
    "error.nativeOnly": "This action is available in the desktop app.",
    "error.unknown": "An unexpected error occurred.",
    "error.fileTooLarge": "This file is too large to open safely.",
    "error.binaryFile": "Binary files are not supported yet."
  }
}
